<?xml version="1.0" encoding="UTF-8"?>
<!DOCTYPE canciones SYSTEM "ej2.dtd">
<canciones>
    <cancion genero="rock">
       <titulo></titulo>
       <duracion></duracion>
       <nombre></nombre>
       <album></album>
       <a単o></a単o>
    </cancion>

    <cancion genero="pop">
        <titulo></titulo>
        <duracion></duracion>
        <nombre></nombre>
        <album></album>
        <compa単ia></compa単ia>
     </cancion>
 
</canciones>